{
  "$schema": "https://json-schema.org/draft/2020-12/schema",
  "$id": "https://raw.githubusercontent.com/rajanbor/map/main/library/schemas/decision.schema.json",
  "title": "MAP architecture decision record",
  "description": "Frontmatter contract for an ADR Markdown document.",
  "type": "object",
  "required": ["kind", "id", "title", "status", "date", "owners"],
  "properties": {
    "kind": { "const": "decision" },
    "id": { "$ref": "document.schema.json#/$defs/id" },
    "title": { "$ref": "document.schema.json#/$defs/title" },
    "status": { "enum": ["proposed", "accepted", "rejected", "superseded"] },
    "date": { "$ref": "document.schema.json#/$defs/date" },
    "owners": {
      "type": "array",
      "items": { "type": "string", "pattern": "^[A-Za-z0-9][A-Za-z0-9-]*$" },
      "minItems": 1,
      "uniqueItems": true
    },
    "tags": {
      "type": "array",
      "items": { "type": "string", "pattern": "^[a-z][a-z0-9-]*$" },
      "uniqueItems": true
    },
    "supersedes": {
      "type": "array",
      "items": { "$ref": "document.schema.json#/$defs/id" },
      "minItems": 1,
      "uniqueItems": true
    },
    "supersededBy": { "$ref": "document.schema.json#/$defs/id" },
    "scope": { "$ref": "document.schema.json#/$defs/scope" },
    "priority": { "$ref": "document.schema.json#/$defs/priority" },
    "targets": { "$ref": "document.schema.json#/$defs/targets" }
  },
  "patternProperties": { "^x-[a-z0-9][a-z0-9-]*$": true },
  "additionalProperties": false,
  "allOf": [
    {
      "if": { "properties": { "status": { "const": "superseded" } } },
      "then": { "required": ["supersededBy"] }
    }
  ]
}
